,place,movie_title,rating,year,star_cast
0,1,The Shawshank Redemption,9.235688734116847,1994,"Frank Darabont (dir.), Tim Robbins, Morgan Freeman"
1,2,The Godfather,9.155927741754791,1972,"Francis Ford Coppola (dir.), Marlon Brando, Al Pacino"
2,3,The Dark Knight,8.991291403068171,2008,"Christopher Nolan (dir.), Christian Bale, Heath Ledger"
3,4,The Godfather Part II,8.983816541580405,1974,"Francis Ford Coppola (dir.), Al Pacino, Robert De Niro"
4,5,12 Angry Men,8.952839274628275,1957,"Sidney Lumet (dir.), Henry Fonda, Lee J. Cobb"
5,6,Schindler's List,8.939742101408557,1993,"Steven Spielberg (dir.), Liam Neeson, Ralph Fiennes"
6,7,The Lord of the Rings: The Return of the King,8.93193841508306,2003,"Peter Jackson (dir.), Elijah Wood, Viggo Mortensen"
7,8,Pulp Fiction,8.846634866485209,1994,"Quentin Tarantino (dir.), John Travolta, Uma Thurman"
8,9,The Lord of the Rings: The Fellowship of the Ring,8.810743064875624,2001,"Peter Jackson (dir.), Elijah Wood, Ian McKellen"
9,1," Il buono, il brutto, il cattivo",8.789317694072405,1966,"Sergio Leone (dir.), Clint Eastwood, Eli Wallach"
10,11,Forrest Gump,8.766808296403244,1994,"Robert Zemeckis (dir.), Tom Hanks, Robin Wright"
11,12,Fight Club,8.747953441503602,1999,"David Fincher (dir.), Brad Pitt, Edward Norton"
12,13,The Lord of the Rings: The Two Towers,8.736293465303495,2002,"Peter Jackson (dir.), Elijah Wood, Ian McKellen"
13,14,Inception,8.73271918920841,2010,"Christopher Nolan (dir.), Leonardo DiCaprio, Joseph Gordon-Levitt"
14,15,The Empire Strikes Back,8.698598296675062,1980,"Irvin Kershner (dir.), Mark Hamill, Harrison Ford"
15,16,The Matrix,8.669200440773295,1999,"Lana Wachowski (dir.), Keanu Reeves, Laurence Fishburne"
16,17,GoodFellas,8.6529739975179,1990,"Martin Scorsese (dir.), Robert De Niro, Ray Liotta"
17,18,One Flew Over the Cuckoo's Nest,8.6382215963506,1975,"Milos Forman (dir.), Jack Nicholson, Louise Fletcher"
18,19,Se7en,8.604544755593118,1995,"David Fincher (dir.), Morgan Freeman, Brad Pitt"
19,20,Shichinin no samurai,8.59779210894257,1954,"Akira Kurosawa (dir.), Toshirô Mifune, Takashi Shimura"
20,21,It's a Wonderful Life,8.597573406297307,1946,"Frank Capra (dir.), James Stewart, Donna Reed"
21,22,The Silence of the Lambs,8.588333935320183,1991,"Jonathan Demme (dir.), Jodie Foster, Anthony Hopkins"
22,23,Saving Private Ryan,8.579536401030778,1998,"Steven Spielberg (dir.), Tom Hanks, Matt Damon"
23,24,Cidade de Deus,8.579387110839217,2002,"Fernando Meirelles (dir.), Alexandre Rodrigues, Leandro Firmino"
24,25,Interstellar,8.570983085579574,2014,"Christopher Nolan (dir.), Matthew McConaughey, Anne Hathaway"
25,26,La vita è bella,8.568582520958604,1997,"Roberto Benigni (dir.), Roberto Benigni, Nicoletta Braschi"
26,27,The Green Mile,8.56330700103179,1999,"Frank Darabont (dir.), Tom Hanks, Michael Clarke Duncan"
27,28,Star Wars,8.548158643737413,1977,"George Lucas (dir.), Mark Hamill, Harrison Ford"
28,29,Terminator 2: Judgment Day,8.537903207687163,1991,"James Cameron (dir.), Arnold Schwarzenegger, Linda Hamilton"
29,30,Back to the Future,8.517793778874832,1985,"Robert Zemeckis (dir.), Michael J. Fox, Christopher Lloyd"
30,31,Sen to Chihiro no kamikakushi,8.515963085612988,2001,"Hayao Miyazaki (dir.), Daveigh Chase, Suzanne Pleshette"
31,32,The Pianist,8.507539979207522,2002,"Roman Polanski (dir.), Adrien Brody, Thomas Kretschmann"
32,33,Psycho,8.506449412380165,1960,"Alfred Hitchcock (dir.), Anthony Perkins, Janet Leigh"
33,34,Gisaengchung,8.499816890869235,2019,"Bong Joon Ho (dir.), Song Kang-ho, Lee Sun-kyun"
34,35,Léon,8.493272324259832,1994,"Luc Besson (dir.), Jean Reno, Gary Oldman"
35,36,The Lion King,8.487927308519811,1994,"Roger Allers (dir.), Matthew Broderick, Jeremy Irons"
36,37,Gladiator,8.486984332290163,2000,"Ridley Scott (dir.), Russell Crowe, Joaquin Phoenix"
37,38,American History X,8.481735683870943,1998,"Tony Kaye (dir.), Edward Norton, Edward Furlong"
38,39,The Departed,8.476159846577097,2006,"Martin Scorsese (dir.), Leonardo DiCaprio, Matt Damon"
39,40,The Usual Suspects,8.469531843646278,1995,"Bryan Singer (dir.), Kevin Spacey, Gabriel Byrne"
40,41,The Prestige,8.46919381901694,2006,"Christopher Nolan (dir.), Christian Bale, Hugh Jackman"
41,42,Whiplash,8.468435622470267,2014,"Damien Chazelle (dir.), Miles Teller, J.K. Simmons"
42,43,Casablanca,8.461528947318925,1942,"Michael Curtiz (dir.), Humphrey Bogart, Ingrid Bergman"
43,44,Hotaru no haka,8.456085848050446,1988,"Isao Takahata (dir.), Tsutomu Tatsumi, Ayano Shiraishi"
44,45,Seppuku,8.455938092258307,1962,"Masaki Kobayashi (dir.), Tatsuya Nakadai, Akira Ishihama"
45,46,The Intouchables,8.453580955267856,2011,"Olivier Nakache (dir.), François Cluzet, Omar Sy"
46,47,Modern Times,8.44700069139053,1936,"Charles Chaplin (dir.), Charles Chaplin, Paulette Goddard"
47,48,Once Upon a Time in the West,8.440875530929636,1968,"Sergio Leone (dir.), Henry Fonda, Charles Bronson"
48,49,Rear Window,8.435446561232224,1954,"Alfred Hitchcock (dir.), James Stewart, Grace Kelly"
49,50,Nuovo Cinema Paradiso,8.435330941625192,1988,"Giuseppe Tornatore (dir.), Philippe Noiret, Enzo Cannavale"
50,51,Alien,8.433392230434878,1979,"Ridley Scott (dir.), Sigourney Weaver, Tom Skerritt"
51,52,City Lights,8.43234289207321,1931,"Charles Chaplin (dir.), Charles Chaplin, Virginia Cherrill"
52,53,Apocalypse Now,8.422980385561553,1979,"Francis Ford Coppola (dir.), Martin Sheen, Marlon Brando"
53,54,Memento,8.419647582886574,2000,"Christopher Nolan (dir.), Guy Pearce, Carrie-Anne Moss"
54,55,Django Unchained,8.408823314666392,2012,"Quentin Tarantino (dir.), Jamie Foxx, Christoph Waltz"
55,56,Raiders of the Lost Ark,8.406310878051352,1981,"Steven Spielberg (dir.), Harrison Ford, Karen Allen"
56,57,WALL·E,8.395183124290803,2008,"Andrew Stanton (dir.), Ben Burtt, Elissa Knight"
57,58,The Lives of Others,8.38395783212446,2006,"Florian Henckel von Donnersmarck (dir.), Ulrich Mühe, Martina Gedeck"
58,59,Sunset Blvd,8.379119996402297,1950,"Billy Wilder (dir.), William Holden, Gloria Swanson"
59,60,Paths of Glory,8.371539247361477,1957,"Stanley Kubrick (dir.), Kirk Douglas, Ralph Meeker"
60,61,The Shining,8.364958999534903,1980,"Stanley Kubrick (dir.), Jack Nicholson, Shelley Duvall"
61,62,The Great Dictator,8.363956396451574,1940,"Charles Chaplin (dir.), Charles Chaplin, Paulette Goddard"
62,63,Avengers: Infinity War,8.361700547017563,2018,"Anthony Russo (dir.), Robert Downey Jr., Chris Hemsworth"
63,64,Witness for the Prosecution,8.359273471902092,1957,"Billy Wilder (dir.), Tyrone Power, Marlene Dietrich"
64,65,Aliens,8.343006091431537,1986,"James Cameron (dir.), Sigourney Weaver, Michael Biehn"
65,66,Spider-Man: Into the Spider-Verse,8.337961546882317,2018,"Bob Persichetti (dir.), Shameik Moore, Jake Johnson"
66,67,American Beauty,8.3305256291225,1999,"Sam Mendes (dir.), Kevin Spacey, Annette Bening"
67,68,Dr Strangelove or: How I Learned to Stop Worrying and Love the Bomb,8.327609543358276,1964,"Stanley Kubrick (dir.), Peter Sellers, George C. Scott"
68,69,The Dark Knight Rises,8.326174446256253,2012,"Christopher Nolan (dir.), Christian Bale, Tom Hardy"
69,70,Oldeuboi,8.320208166517356,2003,"Park Chan-wook (dir.), Choi Min-sik, Yoo Ji-tae"
70,71,Inglourious Basterds,8.318094037317765,2009,"Quentin Tarantino (dir.), Brad Pitt, Diane Kruger"
71,72,Amadeus,8.316442734954125,1984,"Milos Forman (dir.), F. Murray Abraham, Tom Hulce"
72,73,Coco,8.315185161562676,2017,"Lee Unkrich (dir.), Anthony Gonzalez, Gael García Bernal"
73,74,Toy Story,8.313931255316442,1995,"John Lasseter (dir.), Tom Hanks, Tim Allen"
74,75,Joker,8.312976126355506,2019,"Todd Phillips (dir.), Joaquin Phoenix, Robert De Niro"
75,76,Braveheart,8.312658551549864,1995,"Mel Gibson (dir.), Mel Gibson, Sophie Marceau"
76,77,Das Boot,8.31198051960307,1981,"Wolfgang Petersen (dir.), Jürgen Prochnow, Herbert Grönemeyer"
77,78,Avengers: Endgame,8.30388585627871,2019,"Anthony Russo (dir.), Robert Downey Jr., Chris Evans"
78,79,Mononoke-hime,8.303162438772711,1997,"Hayao Miyazaki (dir.), Yôji Matsuda, Yuriko Ishida"
79,80,Once Upon a Time in America,8.294804598913,1984,"Sergio Leone (dir.), Robert De Niro, James Woods"
80,81,Good Will Hunting,8.292629223179333,1997,"Gus Van Sant (dir.), Robin Williams, Matt Damon"
81,82,Kimi no na wa,8.28256942767656,2016,"Makoto Shinkai (dir.), Ryunosuke Kamiki, Mone Kamishiraishi"
82,83,Singin' in the Rain,8.27514115949193,1952,"Stanley Donen (dir.), Gene Kelly, Donald O'Connor"
83,84,3 Idiots,8.275107597704833,2009,"Rajkumar Hirani (dir.), Aamir Khan, Madhavan"
84,85,Requiem for a Dream,8.273799558791906,2000,"Darren Aronofsky (dir.), Ellen Burstyn, Jared Leto"
85,86,Tengoku to jigoku,8.2719336469793,1963,"Akira Kurosawa (dir.), Toshirô Mifune, Yutaka Sada"
86,87,Toy Story 3,8.271040270591435,2010,"Lee Unkrich (dir.), Tom Hanks, Tim Allen"
87,88,Capharnaüm,8.266955135816408,2018,"Nadine Labaki (dir.), Zain Al Rafeea, Yordanos Shiferaw"
88,89,Star Wars: Episode VI - Return of the Jedi,8.264168335579752,1983,"Richard Marquand (dir.), Mark Hamill, Harrison Ford"
89,90,2001: A Space Odyssey,8.261844155586878,1968,"Stanley Kubrick (dir.), Keir Dullea, Gary Lockwood"
90,91,Eternal Sunshine of the Spotless Mind,8.261806992977338,2004,"Michel Gondry (dir.), Jim Carrey, Kate Winslet"
91,92,Reservoir Dogs,8.259117074063285,1992,"Quentin Tarantino (dir.), Harvey Keitel, Tim Roth"
92,93,Idi i smotri,8.258517358005541,1985,"Elem Klimov (dir.), Aleksey Kravchenko, Olga Mironova"
93,94,Jagten,8.257261933421079,2012,"Thomas Vinterberg (dir.), Mads Mikkelsen, Thomas Bo Larsen"
94,95,Citizen Kane,8.250366816098067,1941,"Orson Welles (dir.), Orson Welles, Joseph Cotten"
95,96,M - Eine Stadt sucht einen Mörder,8.25006133277966,1931,"Fritz Lang (dir.), Peter Lorre, Ellen Widmann"
96,97,Lawrence of Arabia,8.249800146674065,1962,"David Lean (dir.), Peter O'Toole, Alec Guinness"
97,98,North by Northwest,8.245867031707999,1959,"Alfred Hitchcock (dir.), Cary Grant, Eva Marie Saint"
98,99,Ikiru,8.24319654414372,1952,"Akira Kurosawa (dir.), Takashi Shimura, Nobuo Kaneko"
99,10, Vertigo,8.242743416459271,1958,"Alfred Hitchcock (dir.), James Stewart, Kim Novak"
100,101,The Apartment,8.241950112864261,1960,"Billy Wilder (dir.), Jack Lemmon, Shirley MacLaine"
101,102,Le fabuleux destin d'Amélie Poulain,8.241336847509329,2001,"Jean-Pierre Jeunet (dir.), Audrey Tautou, Mathieu Kassovitz"
102,103,A Clockwork Orange,8.23880579130274,1971,"Stanley Kubrick (dir.), Malcolm McDowell, Patrick Magee"
103,104,Double Indemnity,8.237812215545052,1944,"Billy Wilder (dir.), Fred MacMurray, Barbara Stanwyck"
104,105,Full Metal Jacket,8.237060393213925,1987,"Stanley Kubrick (dir.), Matthew Modine, R. Lee Ermey"
105,106,Scarface,8.234692632219973,1983,"Brian De Palma (dir.), Al Pacino, Michelle Pfeiffer"
106,107,Hamilton,8.23298800762248,2020,"Thomas Kail (dir.), Lin-Manuel Miranda, Phillipa Soo"
107,108,Incendies,8.226793246220874,2010,"Denis Villeneuve (dir.), Lubna Azabal, Mélissa Désormeaux-Poulin"
108,109,Top Gun: Maverick,8.225915026795022,2022,"Joseph Kosinski (dir.), Tom Cruise, Jennifer Connelly"
109,110,To Kill a Mockingbird,8.22566034098201,1962,"Robert Mulligan (dir.), Gregory Peck, John Megna"
110,111,Heat,8.225402483531433,1995,"Michael Mann (dir.), Al Pacino, Robert De Niro"
111,112,The Sting,8.224723337195934,1973,"George Roy Hill (dir.), Paul Newman, Robert Redford"
112,113,Up,8.224684970389783,2009,"Pete Docter (dir.), Edward Asner, Jordan Nagai"
113,114,Jodaeiye Nader az Simin,8.221395013647163,2011,"Asghar Farhadi (dir.), Payman Maadi, Leila Hatami"
114,115,Metropolis,8.220655741489804,1927,"Fritz Lang (dir.), Brigitte Helm, Alfred Abel"
115,116,Taxi Driver,8.21973435234749,1976,"Martin Scorsese (dir.), Robert De Niro, Jodie Foster"
116,117,LA Confidential,8.218694627723911,1997,"Curtis Hanson (dir.), Kevin Spacey, Russell Crowe"
117,118,Die Hard,8.217751954588998,1988,"John McTiernan (dir.), Bruce Willis, Alan Rickman"
118,119,Snatch,8.217129075409687,2000,"Guy Ritchie (dir.), Jason Statham, Brad Pitt"
119,120,Indiana Jones and the Last Crusade,8.216741295292183,1989,"Steven Spielberg (dir.), Harrison Ford, Sean Connery"
120,121,Ladri di biciclette,8.215936175899085,1948,"Vittorio De Sica (dir.), Lamberto Maggiorani, Enzo Staiola"
121,122,Taare Zameen Par,8.212846780499012,2007,"Aamir Khan (dir.), Darsheel Safary, Aamir Khan"
122,123,1917,8.211037777163238,2019,"Sam Mendes (dir.), Dean-Charles Chapman, George MacKay"
123,124,Der Untergang,8.203354014477034,2004,"Oliver Hirschbiegel (dir.), Bruno Ganz, Alexandra Maria Lara"
124,125,Dangal,8.200009746646616,2016,"Nitesh Tiwari (dir.), Aamir Khan, Sakshi Tanwar"
125,126,Per qualche dollaro in più,8.199056554571591,1965,"Sergio Leone (dir.), Clint Eastwood, Lee Van Cleef"
126,127,Batman Begins,8.197456510667156,2005,"Christopher Nolan (dir.), Christian Bale, Michael Caine"
127,128,The Kid,8.191195018705226,1921,"Charles Chaplin (dir.), Charles Chaplin, Edna Purviance"
128,129,Some Like It Hot,8.190630318108596,1959,"Billy Wilder (dir.), Marilyn Monroe, Tony Curtis"
129,130,The Father,8.18160402767157,2020,"Florian Zeller (dir.), Anthony Hopkins, Olivia Colman"
130,131,All About Eve,8.180016713308392,1950,"Joseph L. Mankiewicz (dir.), Bette Davis, Anne Baxter"
131,132,The Wolf of Wall Street,8.17763765121111,2013,"Martin Scorsese (dir.), Leonardo DiCaprio, Jonah Hill"
132,133,Green Book,8.177550907852567,2018,"Peter Farrelly (dir.), Viggo Mortensen, Mahershala Ali"
133,134,Judgment at Nuremberg,8.171644562718175,1961,"Stanley Kramer (dir.), Spencer Tracy, Burt Lancaster"
134,135,Ran,8.164255593524329,1985,"Akira Kurosawa (dir.), Tatsuya Nakadai, Akira Terao"
135,136,Casino,8.163919812100422,1995,"Martin Scorsese (dir.), Robert De Niro, Sharon Stone"
136,137,The Truman Show,8.160766550736616,1998,"Peter Weir (dir.), Jim Carrey, Ed Harris"
137,138,Pan's Labyrinth,8.160655523628902,2006,"Guillermo del Toro (dir.), Ivana Baquero, Ariadna Gil"
138,139,There Will Be Blood,8.160151125779796,2007,"Paul Thomas Anderson (dir.), Daniel Day-Lewis, Paul Dano"
139,140,Unforgiven,8.158859749556356,1992,"Clint Eastwood (dir.), Clint Eastwood, Gene Hackman"
140,141,The Sixth Sense,8.154527173648288,1999,"M. Night Shyamalan (dir.), Bruce Willis, Haley Joel Osment"
141,142,Shutter Island,8.152754647941613,2010,"Martin Scorsese (dir.), Leonardo DiCaprio, Emily Mortimer"
142,143,A Beautiful Mind,8.151006875573481,2001,"Ron Howard (dir.), Russell Crowe, Ed Harris"
143,144,Jurassic Park,8.149013471230658,1993,"Steven Spielberg (dir.), Sam Neill, Laura Dern"
144,145,Yôjinbô,8.147923409685346,1961,"Akira Kurosawa (dir.), Toshirô Mifune, Eijirô Tôno"
145,146,The Treasure of the Sierra Madre,8.147243761903724,1948,"John Huston (dir.), Humphrey Bogart, Walter Huston"
146,147,Monty Python and the Holy Grail,8.145863619158845,1975,"Terry Gilliam (dir.), Graham Chapman, John Cleese"
147,148,The Great Escape,8.140103614230268,1963,"John Sturges (dir.), Steve McQueen, James Garner"
148,149,No Country for Old Men,8.13988265731939,2007,"Ethan Coen (dir.), Tommy Lee Jones, Javier Bardem"
149,150,Kill Bill: Vol 1,8.138932764074648,2003,"Quentin Tarantino (dir.), Uma Thurman, David Carradine"
150,151,Rashômon,8.138138543292019,1950,"Akira Kurosawa (dir.), Toshirô Mifune, Machiko Kyô"
151,152,Spider-Man: No Way Home,8.136850379183384,2021,"Jon Watts (dir.), Tom Holland, Zendaya"
152,153,The Thing,8.1333899098973,1982,"John Carpenter (dir.), Kurt Russell, Wilford Brimley"
153,154,Finding Nemo,8.131404517649191,2003,"Andrew Stanton (dir.), Albert Brooks, Ellen DeGeneres"
154,155,The Elephant Man,8.12710616287706,1980,"David Lynch (dir.), Anthony Hopkins, John Hurt"
155,156,Chinatown,8.125682365747338,1974,"Roman Polanski (dir.), Jack Nicholson, Faye Dunaway"
156,157,Raging Bull,8.123178224938936,1980,"Martin Scorsese (dir.), Robert De Niro, Cathy Moriarty"
157,158,V for Vendetta,8.122697806349107,2005,"James McTeigue (dir.), Hugo Weaving, Natalie Portman"
158,159,Gone with the Wind,8.12219137351911,1939,"Victor Fleming (dir.), Clark Gable, Vivien Leigh"
159,160,"Lock, Stock and Two Smoking Barrels",8.120394591927614,1998,"Guy Ritchie (dir.), Jason Flemyng, Dexter Fletcher"
160,161,Inside Out,8.120138262078138,2015,"Pete Docter (dir.), Amy Poehler, Bill Hader"
161,162,Dial M for Murder,8.11963364394964,1954,"Alfred Hitchcock (dir.), Ray Milland, Grace Kelly"
162,163,El secreto de sus ojos,8.118016912987766,2009,"Juan José Campanella (dir.), Ricardo Darín, Soledad Villamil"
163,164,Hauru no ugoku shiro,8.117395613970407,2004,"Hayao Miyazaki (dir.), Chieko Baisho, Takuya Kimura"
164,165,"Three Billboards Outside Ebbing, Missouri",8.11142858725564,2017,"Martin McDonagh (dir.), Frances McDormand, Woody Harrelson"
165,166,The Bridge on the River Kwai,8.110828570369607,1957,"David Lean (dir.), William Holden, Alec Guinness"
166,167,Trainspotting,8.110480494503516,1996,"Danny Boyle (dir.), Ewan McGregor, Ewen Bremner"
167,168,Prisoners,8.10586132780933,2013,"Denis Villeneuve (dir.), Hugh Jackman, Jake Gyllenhaal"
168,169,Warrior,8.102687595519182,2011,"Gavin O'Connor (dir.), Tom Hardy, Nick Nolte"
169,170,Fargo,8.102521660864051,1996,"Joel Coen (dir.), William H. Macy, Frances McDormand"
170,171,Gran Torino,8.100552096831535,2008,"Clint Eastwood (dir.), Clint Eastwood, Bee Vang"
171,172,Tonari no Totoro,8.092478984834525,1988,"Hayao Miyazaki (dir.), Hitoshi Takagi, Noriko Hidaka"
172,173,Catch Me If You Can,8.091275502884809,2002,"Steven Spielberg (dir.), Leonardo DiCaprio, Tom Hanks"
173,174,Million Dollar Baby,8.088772782850546,2004,"Clint Eastwood (dir.), Hilary Swank, Clint Eastwood"
174,175,Bacheha-Ye aseman,8.086457719995597,1997,"Majid Majidi (dir.), Mohammad Amir Naji, Amir Farrokh Hashemian"
175,176,Blade Runner,8.084873046377139,1982,"Ridley Scott (dir.), Harrison Ford, Rutger Hauer"
176,177,The Gold Rush,8.08423564585412,1925,"Charles Chaplin (dir.), Charles Chaplin, Mack Swain"
177,178,Before Sunrise,8.081161538171582,1995,"Richard Linklater (dir.), Ethan Hawke, Julie Delpy"
178,179,Klaus,8.081045061927304,2019,"Sergio Pablos (dir.), Jason Schwartzman, J.K. Simmons"
179,180,12 Years a Slave,8.0805853552282,2013,"Steve McQueen (dir.), Chiwetel Ejiofor, Michael Kenneth Williams"
180,181,Harry Potter and the Deathly Hallows: Part 2,8.080582045274275,2011,"David Yates (dir.), Daniel Radcliffe, Emma Watson"
181,182,On the Waterfront,8.079231119806535,1954,"Elia Kazan (dir.), Marlon Brando, Karl Malden"
182,183,Ben-Hur,8.077885746121499,1959,"William Wyler (dir.), Charlton Heston, Jack Hawkins"
183,184,The Grand Budapest Hotel,8.077117568510566,2014,"Wes Anderson (dir.), Ralph Fiennes, F. Murray Abraham"
184,185,Gone Girl,8.077041497419392,2014,"David Fincher (dir.), Ben Affleck, Rosamund Pike"
185,186,Smultronstället,8.076209798990583,1957,"Ingmar Bergman (dir.), Victor Sjöström, Bibi Andersson"
186,187,The General,8.07538415599996,1926,"Clyde Bruckman (dir.), Buster Keaton, Marion Mack"
187,188,The Third Man,8.074002173750047,1949,"Carol Reed (dir.), Orson Welles, Joseph Cotten"
188,189,In the Name of the Father,8.073876062390218,1993,"Jim Sheridan (dir.), Daniel Day-Lewis, Pete Postlethwaite"
189,190,Barry Lyndon,8.073556881323377,1975,"Stanley Kubrick (dir.), Ryan O'Neal, Marisa Berenson"
190,191,The Deer Hunter,8.073488170210974,1978,"Michael Cimino (dir.), Robert De Niro, Christopher Walken"
191,192,Hacksaw Ridge,8.071091046720055,2016,"Mel Gibson (dir.), Andrew Garfield, Sam Worthington"
192,193,Le salaire de la peur,8.070021926515329,1953,"Henri-Georges Clouzot (dir.), Yves Montand, Charles Vanel"
193,194,Salinui chueok,8.069009237606123,2003,"Bong Joon Ho (dir.), Song Kang-ho, Kim Sang-kyung"
194,195,Sherlock Jr,8.068177362823159,1924,"Buster Keaton (dir.), Buster Keaton, Kathryn McGuire"
195,196,Relatos salvajes,8.067562615758687,2014,"Damián Szifron (dir.), Darío Grandinetti, María Marull"
196,197,Mr Smith Goes to Washington,8.066623597707581,1939,"Frank Capra (dir.), James Stewart, Jean Arthur"
197,198,Mad Max: Fury Road,8.063647895902344,2015,"George Miller (dir.), Tom Hardy, Charlize Theron"
198,199,Mary and Max,8.062883027321488,2009,"Adam Elliot (dir.), Toni Collette, Philip Seymour Hoffman"
199,200,Det sjunde inseglet,8.062593323046935,1957,"Ingmar Bergman (dir.), Max von Sydow, Gunnar Björnstrand"
200,201,How to Train Your Dragon,8.061434812975317,2010,"Dean DeBlois (dir.), Jay Baruchel, Gerard Butler"
201,202,Room,8.0606844789517,2015,"Lenny Abrahamson (dir.), Brie Larson, Jacob Tremblay"
202,203,"Monsters, Inc",8.060625544117922,2001,"Pete Docter (dir.), Billy Crystal, John Goodman"
203,204,Jaws,8.059991222212554,1975,"Steven Spielberg (dir.), Roy Scheider, Robert Shaw"
204,205,Dead Poets Society,8.059542187556309,1989,"Peter Weir (dir.), Robin Williams, Robert Sean Leonard"
205,206,The Big Lebowski,8.058440943400255,1998,"Joel Coen (dir.), Jeff Bridges, John Goodman"
206,207,Tôkyô monogatari,8.055212679493271,1953,"Yasujirô Ozu (dir.), Chishû Ryû, Chieko Higashiyama"
207,208,La passion de Jeanne d'Arc,8.05355880068707,1928,"Carl Theodor Dreyer (dir.), Maria Falconetti, Eugene Silvain"
208,209,Ford v Ferrari,8.049090702771043,2019,"James Mangold (dir.), Matt Damon, Christian Bale"
209,210,Hotel Rwanda,8.048989781472155,2004,"Terry George (dir.), Don Cheadle, Sophie Okonedo"
210,211,Rocky,8.04639962892898,1976,"John G. Avildsen (dir.), Sylvester Stallone, Talia Shire"
211,212,Platoon,8.044377152784268,1986,"Oliver Stone (dir.), Charlie Sheen, Tom Berenger"
212,213,Ratatouille,8.042086152229613,2007,"Brad Bird (dir.), Brad Garrett, Lou Romano"
213,214,Spotlight,8.040809221772104,2015,"Tom McCarthy (dir.), Mark Ruffalo, Michael Keaton"
214,215,The Terminator,8.040209330858708,1984,"James Cameron (dir.), Arnold Schwarzenegger, Linda Hamilton"
215,216,Logan,8.039873216757478,2017,"James Mangold (dir.), Hugh Jackman, Patrick Stewart"
216,217,Stand by Me,8.038306000969097,1986,"Rob Reiner (dir.), Wil Wheaton, River Phoenix"
217,218,Rush,8.035721100719408,2013,"Ron Howard (dir.), Daniel Brühl, Chris Hemsworth"
218,219,Network,8.034752515256452,1976,"Sidney Lumet (dir.), Faye Dunaway, William Holden"
219,220,Before Sunset,8.03243389840853,2004,"Richard Linklater (dir.), Ethan Hawke, Julie Delpy"
220,221,Into the Wild,8.031864436880541,2007,"Sean Penn (dir.), Emile Hirsch, Vince Vaughn"
221,222,The Wizard of Oz,8.030980016223069,1939,"Victor Fleming (dir.), Judy Garland, Frank Morgan"
222,223,Pather Panchali,8.028675195689384,1955,"Satyajit Ray (dir.), Kanu Bannerjee, Karuna Bannerjee"
223,224,The Best Years of Our Lives,8.027770157938095,1946,"William Wyler (dir.), Myrna Loy, Dana Andrews"
224,225,Groundhog Day,8.027666664810555,1993,"Harold Ramis (dir.), Bill Murray, Andie MacDowell"
225,226,The Exorcist,8.026494351863954,1973,"William Friedkin (dir.), Ellen Burstyn, Max von Sydow"
226,227,To Be or Not to Be,8.025356768129912,1942,"Ernst Lubitsch (dir.), Carole Lombard, Jack Benny"
227,228,The Incredibles,8.02497443575678,2004,"Brad Bird (dir.), Craig T. Nelson, Samuel L. Jackson"
228,229,La haine,8.023871389366239,1995,"Mathieu Kassovitz (dir.), Vincent Cassel, Hubert Koundé"
229,230,Pirates of the Caribbean: The Curse of the Black Pearl,8.022952772978716,2003,"Gore Verbinski (dir.), Johnny Depp, Geoffrey Rush"
230,231,La battaglia di Algeri,8.02261764965273,1966,"Gillo Pontecorvo (dir.), Brahim Hadjadj, Jean Martin"
231,232,The Grapes of Wrath,8.022181363878408,1940,"John Ford (dir.), Henry Fonda, Jane Darwell"
232,233,Jai Bhim,8.021992328859682,2021,"T.J. Gnanavel (dir.), Suriya, Lijo Mol Jose"
233,234,Hachi: A Dog's Tale,8.021957995907396,2009,"Lasse Hallström (dir.), Richard Gere, Joan Allen"
234,235,Babam ve Oglum,8.020650985171523,2005,"Çagan Irmak (dir.), Çetin Tekindor, Fikret Kuskan"
235,236,Amores perros,8.01997801612638,2000,"Alejandro G. Iñárritu (dir.), Emilio Echevarría, Gael García Bernal"
236,237,Rebecca,8.019808561185764,1940,"Alfred Hitchcock (dir.), Laurence Olivier, Joan Fontaine"
237,238,Cool Hand Luke,8.01879333326492,1967,"Stuart Rosenberg (dir.), Paul Newman, George Kennedy"
238,239,Ah-ga-ssi,8.016738659804167,2016,"Park Chan-wook (dir.), Kim Min-hee, Ha Jung-woo"
239,240,Les quatre cents coups,8.015060383343421,1959,"François Truffaut (dir.), Jean-Pierre Léaud, Albert Rémy"
240,241,The Sound of Music,8.013161500104028,1965,"Robert Wise (dir.), Julie Andrews, Christopher Plummer"
241,242,It Happened One Night,8.012732443391625,1934,"Frank Capra (dir.), Clark Gable, Claudette Colbert"
242,243,Persona,8.012043495146099,1966,"Ingmar Bergman (dir.), Bibi Andersson, Liv Ullmann"
243,244,Life of Brian,8.009666258274523,1979,"Terry Jones (dir.), Graham Chapman, John Cleese"
244,245,The Iron Giant,8.006191942159399,1999,"Brad Bird (dir.), Eli Marienthal, Harry Connick Jr."
245,246,Dersu Uzala,8.005830027006855,1975,"Akira Kurosawa (dir.), Maksim Munzuk, Yuriy Solomin"
246,247,The Help,8.005117021820345,2011,"Tate Taylor (dir.), Viola Davis, Emma Stone"
247,248,Aladdin,8.0041475714659,1992,"Ron Clements (dir.), Scott Weinger, Robin Williams"
248,249,Gandhi,8.002128578419217,1982,"Richard Attenborough (dir.), Ben Kingsley, John Gielgud"
249,250,Dances with Wolves,8.001615649604302,1990,"Kevin Costner (dir.), Kevin Costner, Mary McDonnell"
